{
  "version": 1,
  "name": "folio",
  "headline": "Folio",
  "subline": "De la place pour les idées.",
  "fontFamily": "\"Hanko Sans\", sans-serif",
  "colors": {
    "light": {
      "background": "#fff8d8",
      "foreground": "#402951",
      "primary": "#6a3c91",
      "primaryForeground": "#ffffff",
      "card": "#fffdf3",
      "muted": "#7f648c",
      "input": "#fffdf3",
      "border": "#cfc8cb"
    },
    "dark": {
      "background": "#fff8d8",
      "foreground": "#402951",
      "primary": "#6a3c91",
      "primaryForeground": "#ffffff",
      "card": "#fffdf3",
      "muted": "#7f648c",
      "input": "#fffdf3",
      "border": "#cfc8cb"
    }
  },
  "layout": {
    "cardRadius": "0px",
    "controlRadius": "0px",
    "contentWidth": "460px"
  }
}
