{
  "version": 1,
  "name": "evidence",
  "headline": "Clarity",
  "subline": "Clarity comes naturally.",
  "fontFamily": "\"Hanko Sans\", sans-serif",
  "colors": {
    "light": {
      "background": "#f5f7fb",
      "foreground": "#1c283b",
      "primary": "#245dda",
      "primaryForeground": "#ffffff",
      "card": "#ffffff",
      "muted": "#58677d",
      "input": "#ffffff",
      "border": "#c6c9ce"
    },
    "dark": {
      "background": "#f5f7fb",
      "foreground": "#1c283b",
      "primary": "#245dda",
      "primaryForeground": "#ffffff",
      "card": "#ffffff",
      "muted": "#58677d",
      "input": "#ffffff",
      "border": "#c6c9ce"
    }
  },
  "layout": {
    "cardRadius": "12px",
    "controlRadius": "9px",
    "contentWidth": "460px"
  }
}
