{
  "version": 1,
  "name": "civique",
  "headline": "Civique",
  "subline": "La simplicité au service de tous.",
  "fontFamily": "Arial, sans-serif",
  "colors": {
    "light": {
      "background": "#ffffff",
      "foreground": "#172b43",
      "primary": "#1a538a",
      "primaryForeground": "#ffffff",
      "card": "#ffffff",
      "muted": "#596c80",
      "input": "#ffffff",
      "border": "#c5cad0"
    },
    "dark": {
      "background": "#ffffff",
      "foreground": "#172b43",
      "primary": "#1a538a",
      "primaryForeground": "#ffffff",
      "card": "#ffffff",
      "muted": "#596c80",
      "input": "#ffffff",
      "border": "#c5cad0"
    }
  },
  "layout": {
    "cardRadius": "0px",
    "controlRadius": "0px",
    "contentWidth": "460px"
  }
}
